{
  "schemaVersion": "1.0.0",
  "sourceBooks": ["the-wisdom-bridge", "mans-search-for-meaning", "tripadi"],
  "questions": [
    {
      "id": "q1",
      "prompt": "What creates a durable sense of meaning or purpose?",
      "framedBy": "curator",
      "answeringNodeIds": [
        "mans-search-for-meaning:topic:three-roads",
        "the-wisdom-bridge:concept:c5-preparation"
      ]
    },
    {
      "id": "q2",
      "prompt": "What sustains motivation once the initial drive fades?",
      "framedBy": "curator",
      "answeringNodeIds": [
        "mans-search-for-meaning:topic:will-to-meaning",
        "the-wisdom-bridge:concept:c5-meditation",
        "tripadi:concept:pillar-action"
      ]
    }
  ],
  "vocabularyClusters": [
    {
      "id": "vc1",
      "canonicalTerm": "meaning-through-discipline",
      "definition": "Meaning/purpose is produced by a deliberate inner practice, not received passively.",
      "termsByBook": [
        { "bookId": "mans-search-for-meaning", "nodeId": "mans-search-for-meaning:topic:three-roads", "termAsUsed": "the three roads to meaning (work, love, suffering)" },
        { "bookId": "the-wisdom-bridge", "nodeId": "the-wisdom-bridge:concept:c5-preparation", "termAsUsed": "preparation" }
      ]
    },
    {
      "id": "vc2",
      "canonicalTerm": "inner-practice-sustains-drive",
      "definition": "A repeated, deliberate inner practice (not a one-time insight) is what keeps motivation or meaning alive over time.",
      "termsByBook": [
        { "bookId": "mans-search-for-meaning", "nodeId": "mans-search-for-meaning:topic:will-to-meaning", "termAsUsed": "will to meaning" },
        { "bookId": "the-wisdom-bridge", "nodeId": "the-wisdom-bridge:concept:c5-meditation", "termAsUsed": "meditation" },
        { "bookId": "tripadi", "nodeId": "tripadi:concept:pillar-meditation", "termAsUsed": "meditation practice (Pillar 2 of TMT)" }
      ]
    }
  ],
  "conflictClusters": [
    {
      "id": "cc1",
      "topic": "Where does meaning originate?",
      "questionId": "q1",
      "positions": [
        { "bookId": "mans-search-for-meaning", "nodeId": "mans-search-for-meaning:topic:tragic", "stance": "Meaning is forged retroactively, through how one responds to unchosen suffering (tragic optimism)." },
        { "bookId": "the-wisdom-bridge", "nodeId": "the-wisdom-bridge:concept:c5-preparation", "stance": "Meaning/purpose is built proactively, through preparation and eliminating doubt before adversity arrives." }
      ]
    },
    {
      "id": "cc2",
      "topic": "Where does lasting motivation come from once initial resolve fades?",
      "questionId": "q2",
      "positions": [
        { "bookId": "mans-search-for-meaning", "nodeId": "mans-search-for-meaning:topic:will-to-meaning", "stance": "Motivation is sustained by an existential will oriented toward a specific meaning, not by willpower alone." },
        { "bookId": "the-wisdom-bridge", "nodeId": "the-wisdom-bridge:concept:c5-meditation", "stance": "Motivation is sustained by meditation that produces inner peace and harmony, which in turn removes doubt." },
        { "bookId": "tripadi", "nodeId": "tripadi:concept:pillar-action", "stance": "Motivation is sustained mechanically through a three-pillar loop: mind conditioning feeds meditation, which feeds repeated action, which reinforces the mind." }
      ]
    }
  ],
  "crossEdges": [
    {
      "id": "ce1",
      "source": "mans-search-for-meaning:topic:three-roads",
      "target": "the-wisdom-bridge:concept:c5-preparation",
      "relation": "shares_vocabulary_with",
      "label": "both frame meaning as a discipline, not a discovery"
    },
    {
      "id": "ce2",
      "source": "the-wisdom-bridge:concept:c5-meditation",
      "target": "tripadi:concept:pillar-meditation",
      "relation": "shares_vocabulary_with",
      "label": "both use meditation as the practice that removes doubt and stabilizes drive"
    },
    {
      "id": "ce3",
      "source": "mans-search-for-meaning:topic:will-to-meaning",
      "target": "tripadi:concept:pillar-mind",
      "relation": "shares_vocabulary_with",
      "label": "both locate the root of motivation in an oriented inner will/mind, not external reward"
    }
  ]
}
